{
  "id": "navgrid_main",
  "type": "navgrid",
  "description": "Tavern surroundings: a wall block at world (10..13, -10..-7) and a stealth-grass patch at (-12..-7, 8..11). Row 0 = Z -16.",
  "origin": [-16, 0, -16],
  "cellSize": 1.0,
  "legend": {
    ".": { "cost": 1 },
    "#": { "walkable": false },
    "g": { "cost": 1.2, "tags": ["stealth_vegetation"] }
  },
  "rows": [
    "................................",
    "................................",
    "................................",
    "................................",
    "................................",
    "................................",
    "..........................####..",
    "..........................####..",
    "..........................####..",
    "..........................####..",
    "................................",
    "................................",
    "................................",
    "................................",
    "................................",
    "................................",
    "................................",
    "................................",
    "................................",
    "................................",
    "................................",
    "................................",
    "................................",
    "................................",
    "....gggggg......................",
    "....gggggg......................",
    "....gggggg......................",
    "....gggggg......................",
    "................................",
    "................................",
    "................................",
    "................................"
  ]
}
